{"api_version":"1.0","data":{"client":{"id":"example-client","path":"/Users/example/Music/Mixes/Clients/Example Client"},"configuration_path":"/Users/example/Music/Mixes/Clients/Example Client/client.json","workspace_path":"/Users/example/Music/Mixes","would_create":["/Users/example/Music/Mixes/Clients/Example Client/client.json","/Users/example/Music/Mixes/Clients/Example Client/Projects"]},"errors":[],"operation":"client.create","status":"planned","warnings":[]}
